year,approach,framework,author,pubtitle,link,description
2009,Adaptive,Business Model Innovation,Lindgardt. Zhenya. Martin Reeves. George Stalk. and Michael S. Deimler.,Business Model Innovation: When the Game Gets Tough. Change the Game,https://www.bcg.com/documents/file36456.pdf,Business model innovation involves six factors: product and service offering. target segments. revenue model. value chain. cost model. and organization. BMI is defined as the act of changing multiple business-model components. leading to delivery of a superior value proposition. A core tenet of BMI is that for innovation to be truly effective. it needs to occur simultaneously on multiple dimensions. Product innovation alone. for example. will generate subpar returns.
2010,Adaptive,Adaptive Advantage,Reeves. Martin. Michael S. Deimler. Yves Morieux. and Ron Nicol.,Adaptive Advantage,http://www.bcg.com/documents/file37859.pdf,Adaptive advantage proves that the traditional dimensions of competitive advantage (scale and position) have become mostly obsolete. It introduces five new dimensions of advantage as the basis for success in turbulent times: signal advantage. experimentation advantage. organization advantage. systems advantage. and ecosocial advantage.
2012,Classical,Competitive Strategy: Options and Games,Chevalier-Roignant. Benoit and Lenos Trigeorgis.,Competitive Strategy: Options and Games,http://mitpress.mit.edu/books/competitive-strategy,Chevalier-Roignant and Trigeorgis describe an emerging paradigm that can quantify and balance commitment and flexibility. "Option games" allow for the combination of decision-making approaches to real options and game theory. The authors first discuss prerequisite concepts and tools of basic game theory. industrial organization. and real-options analysis. and then present the new approach in discrete time and. later. in continuous time.
2013,Adaptive,Transient Competitive Advantage,McGrath. Rita Gunther.,The End of Competitive Advantage: How to Keep Your Strategy Moving as Fast as Your Business,http://ritamcgrath.com/books/the-end-of-competitive-advantage/,McGrath argues that it's time to go beyond the very concept of sustainable competitive advantage. Instead. organizations need to forge a new path to winning: capturing opportunities fast. exploiting them decisively. and moving on even before they are exhausted. She shows how to do this with a new set of practices based on the notion of transient competitive advantage.
2013,Classical,Algorithmic Strategy,Moldoveanu. Mihnea C.,Algorithmic Foundations for Business Strategy,http://papers.ssrn.com/sol3/papers.cfm?abstract_id=2210077,Algorithmic strategy. like game theory. rests on the concept that the behavior of individual actors in a given market and the probabilities and outcomes of specific decisions can be modeled effectively. Given that. strategies can be articulated as algorithms that maximize a particular objective function (for example. profitability) or that operate with specific constrains (for example. maximum risk). The work highlights a set of dynamic search and adaptation capabilities that can be studied using the algorithmic and computational properties of the problems they are meant to solve and the efficiency and reliability by which they search a solution space.
